Id,Title,Type,Geography,Geography ISO,Frameworks,Responses,Instruments,Document Types,Natural Hazards,Keywords,Sectors,Events,Documents,Parent Legislation,Description
1132,Regulations on the Efficient Use of Energy (Law No. 7447),legislative,Costa Rica,CRI,"",Mitigation,"Standards, obligations and norms|Regulation;Capacity building|Governance;Education, training and knowledge dissemination|Information",Law,"",Energy Demand;Transport,Buildings;Energy;Transport,13/12/1994|Law passed||;30/06/2010|Last amended||,Link to updated document|http://www.pgrweb.go.cr/scij/Busqueda/Normativa/Normas/nrm_texto_completo.aspx?param1=NRTC&nValor1=1&nValor2=24436&nValor3=94042&param2=1&strTipM=TC&lResultado=9&strSim=simp|es,,"This law consolidates the participation of the State in the promotion and gradual execution of the programme for the efficient use of energy. It also attempts to establish mechanisms to achieve energy efficiency, taking environmental protection into account.<br>&nbsp;<br>&nbsp;The Ministry for Natural Resources and Energy is responsible for the implementation, monitoring the 'National Programme for the Rational Use of Energy'. To promote this objective, the law establishes the obligation to execute energy efficiency programmes of rational use of energy in companies with high consumption levels. Companies have the legal obligation to report the precise amount of energy they use. When the amount is beyond the maximum level allowed by the Ministry, businesses are notified and have three months to submit a plan to reduce their energy consumption, within six months. The government can, in certain circumstances, provide specific technical recommendations to these companies.<br>&nbsp;<br>&nbsp;The Law calls for the creation of campaigns to raise public awareness on the rational use of energy, including educational programmes in schools. All products must publicly announce their level of energy consumption.<br>&nbsp;<br>&nbsp;Producers of machines and/or vehicles that use energy (of any source) must obtain authorisation from the Ministry relating to their energy efficiency before beginning production of these goods. The import of similar equipment (including vehicles) is conditional on the submission of energy efficiency data.<br>&nbsp;<br>&nbsp;The law determines that the Ministry for Natural Resources, Energy and Mining is in charge of determining limits for emissions from vehicles, to be monitored and controlled by the Ministry of Transport.<br>&nbsp;<br>&nbsp;Additionally, it exempts equipment used for renewable energy from import duties and provides for other tax exemptions (excise tax, ad valorem tax, general sales tax, specific customs tax). Fines and penalties apply upon breaching the law.<br>&nbsp;<br>&nbsp;Additional legislative and executive regulation specifies mechanisms of support for clean technologies and rational use of energy. Those include an Executive Decree reforming the incentives system for the use of hybrid electrical vehicles; a modification of the law to provide tax exemption for equipment and certain materials, imported as well as produced domestically that contribute to energy savings and rational use; a decree that establishes new rules of the ‘Bandera Azul Ecológica'certification programme for climate-friendly communities and private housing (energy efficiency, low GHG emissions, etc.); and a directive that requires the energy and telecommunications sectors to adopt administrative, financial, legal and technical measuresto ensure citizens' access to cleaner energies at the least possible cost."
1133,Energy Law (Law No. 7200),legislative,Costa Rica,CRI,"",Mitigation,"",Law,"",Energy Supply;Energy Demand,Energy;LULUCF;Transport,18/10/1990|Law passed,,,This law requires MINAE to establish company-level power indices based on their level of economic activity. The law and its subsequent regulations outline the obligatory nature of executing projects that conserve electricity. They also include an incentive programme for businesses that promote the efficient use of energy.
2061,Law no 9366 on Railroad Electrification,legislative,Costa Rica,CRI,"",Mitigation,Capacity building|Governance,Law,"",Institutions / Administrative Arrangements;Transport,Transport;Urban,07/06/2016|Law passed||,Full text|https://climate-laws.org/rails/active_storage/blobs/eyJfcmFpbHMiOnsibWVzc2FnZSI6IkJBaHBBdmNIIiwiZXhwIjpudWxsLCJwdXIiOiJibG9iX2lkIn19--02a6bd98e4f4649c7f13b46efdcac0efdff1d0a0/f|,,"The Law addresses the transport sector, which is the sector with the highest share of emissions in Costa Rica. It modernises the Costa Rican Railroad Institute (INCOFER) and allows it to take on debt up to a maximum equivalent to 40 per cent of its assets, in order to build an electric train network, with the objective of reducing greenhouse gas emissions in the transport sector.<br>&nbsp;The full name of the law is: Fortalecimiento del Instituto Costarricense de Ferrocarriles (INCOFER) y Promoción del Tren Eléctrico Interurbano de la Gran Area Metropolitana."
8696,Law no 9518 on incentives and promotion of electric transport and application decrees 41092 and 42489,legislative,Costa Rica,CRI,"",Mitigation,"Tax incentives|Economic;Processes, plans and strategies|Governance",Law,"",EV,Transport,14/12/2017|Law passed||,Full text|https://climate-laws.org/rails/active_storage/blobs/eyJfcmFpbHMiOnsibWVzc2FnZSI6IkJBaHBBdXdGIiwiZXhwIjpudWxsLCJwdXIiOiJibG9iX2lkIn19--5d5948869f89b0caed759c08b5763599571ec2cc/f|;Full text|http://www.pgrweb.go.cr/scij/Busqueda/Normativa/Normas/nrm_texto_completo.aspx?param1=NRTC&nValor1=1&nValor2=85810&nValor3=111104&strTipM=TC|;Link to decree 42489 on official website|http://www.pgrweb.go.cr/scij/Busqueda/Normativa/Normas/nrm_texto_completo.aspx?param1=NRTC&nValor1=1&nValor2=92387&nValor3=122303&strTipM=TC|;Link to decree 41092 on official website|http://www.pgrweb.go.cr/scij/Busqueda/Normativa/Normas/nrm_texto_completo.aspx?nValor1=1&nValor2=86581|,,"This law creates the regulatory framework to regulate the promotion of electric transport in the country and strengthen public policies to encourage its use within the public sector and in the general public.<br>&nbsp;<br>&nbsp;This law regulates the public administrative organization linked to electric transport, institutional competences and their stimulus, through exemptions, incentives and public policies, in compliance with the commitments acquired in international conventions ratified by the country and Article 50 of the Constitution.<br><br>Decree 41092-MINAE-H-MOPT regulates incentives for electric transport.<br><br>Executive decree 42489-MINAE-H regulates the exemption of the tax on sales and the selective consumption tax on spare parts for electric vehicles and exemption from the selective consumption tax and 1% on the customs value for parts and recharging centers."
1137,Act No. 75 on the Civil Defence and Decree-Law No. 170 on the System of measures of Civil Defence (Disaster-management as response to frequent extreme events),legislative,Cuba,CUB,"",Adaptation;Disaster Risk Management,"Capacity building|Governance;Institutional mandates|Governance;Processes, plans and strategies|Governance;Research & Development, knowledge generation|Information",Law,"",Adaptation;Institutions / Administrative Arrangements,Disaster Risk Management (Drm);Economy-wide;Transport,21/12/1994|Law passed||;19/05/1997|Last amended||,Link to law 75 on official website|http://www.parlamentocubano.gob.cu/index.php/documento/ley-de-la-defensa-nacional/|es;Full text of Decree Law 170 (PDF)|https://climate-laws.org/rails/active_storage/blobs/eyJfcmFpbHMiOnsibWVzc2FnZSI6IkJBaHBBbW9NIiwiZXhwIjpudWxsLCJwdXIiOiJibG9iX2lkIn19--bda483175a199dedc2476d73b4a91172f7c936bc/cub82158.pdf|es,,"Law No. 75 defines Civil Defence as 'a system of defensive state measures taken in peacetime during exceptional circumstances, aimed at protecting the population and the national economy from destruction by enemy or from natural disasters and other types of catastrophes, including deterioration of the environment'. When the exceptional circumstances apply, the government can use all the resources and activities of the country to respond to the needs of national defence.&nbsp;<br><br>Decree-Law 170 then lays down the different Civil Defence measures that can be developed to help to prevent the special circumstances from occurring or minimise their impacts. It establishes the National Etat-Major of Civil Defence that co-ordinates the deployment of measures by different state organs, economic entities and social institutions in order to protect the population and the economy. Although the laws do not directly mention climate change, they lay down clear adaptation measures to extreme weather events, whose increased occurrence over the past years is recognised as part of the impact of climate change.<br>&nbsp;<br>&nbsp;In addition, Directive 1 of the Vice-President of the National Defence Council (2010) calls on the Ministry of Science, Technology and Environment to carry out studies on the dangers, vulnerability and risk of disasters, as well as evaluation of potential climate change impacts."
1139,"Decree-Law No. 147 on the Reorganisation of Central State Administrative Organs (creation of Ministry of Sciences, Technology and Environment responsible for Climate Change policy)",legislative,Cuba,CUB,"",Adaptation;Mitigation,"Processes, plans and strategies|Governance",Decree Law,"",Institutions / Administrative Arrangements,Transport,21/04/1994|Law passed||,Full text|https://climate-laws.org/rails/active_storage/blobs/eyJfcmFpbHMiOnsibWVzc2FnZSI6IkJBaHBBbWtIIiwiZXhwIjpudWxsLCJwdXIiOiJibG9iX2lkIn19--38f983960c1781550517020b54f394c820a10a95/f|es,,"The Decree-Law abolishes the National Commission for Energy and other state bodies and transfers its functions to the Ministry of Economy and Planning and Ministry of Basic Industry. It further transforms the Academy of Science of Cuba into the Ministry of Sciences, Technology and Environment, and assigns it the responsibilities previously carried out by the National Commission for Protection of the Environment and the Rational Use of Natural Resources, the National Commission for Atomic Energy (established in 1979) and the Commission Responsible for the Grand National Park Sierra Maestra."
8602,Decree Law no 337 on the terrestrial waters,legislative,Cuba,CUB,"",Adaptation,"",Decree Law,"",Adaptation,Water,01/07/2017|Law passed||,Full text|https://climate-laws.org/rails/active_storage/blobs/eyJfcmFpbHMiOnsibWVzc2FnZSI6IkJBaHBBZzRIIiwiZXhwIjpudWxsLCJwdXIiOiJibG9iX2lkIn19--f9fdd5e9be1b558eaeac2f3e5610ebb31c131e09/f|es,,"The law sets the legal framework to organise the resilience of the country's inner waters, and mentions climate change adaptation as a core goal.<br>&nbsp;<br>&nbsp;The law was approved by the Cuban Parliament and published in the Official Gazette no 124, with Decree no. 337."
10339,Constitution of Cuba,legislative,Cuba,CUB,"",Adaptation;Mitigation,"",Constitution,"",CBDR;equity,Economy-wide,25/02/2019|Constitution adopted||,Full text|https://www.constituteproject.org/constitution/Cuba_2019.pdf?lang=en|en,,"The Constitution of Cuba was approved in a public national referendum in February 2019. It was drafted and submitted to public consultation between 2018 and 2019. The final version, published in January 2019 ahead of the referendum, was approved by 86.85 percent out of 8.7 million voters. In its preamble, the Constitution states Cuba’s commitment to “never returning to capitalism as a regime sustained by the exploitation of man by man, and that it is only in socialism and communism that a human being can achieve his or her full dignity”.&nbsp;<br><br>The Constitution’s climate provision is motivated by Cuba’s sovereignty, as well as the antiimperialist and internationalist principles. This provision sets forth that the Republic will respond to climate change in light of the threat that it represents to humans, but considering the common but differentiated responsibilities principle, the international economic order, as well as production and consumption patterns. This climate provision is set in the Constitution’s main text in article 16, which reads: “The Republic of Cuba bases its international relations on the exercise of its sovereignty as well as on the antiimperialist and internationalist principles in accordance with the interests of the people and, in consequence: [..] f. Promotes the protection and conservation of the environment as well as responding to climate change, which threatens the survival of the human species, through the recognition of common, yet differential, responsibilities; the establishment of a more just and equitable international economic order as well as the eradication of irrational patterns of production and consumption; […]”."
4952,2014-390 Act of 20 June 2014 guidance on sustainable development,legislative,Côte d'Ivoire,CIV,"",Adaptation;Mitigation,Capacity building|Governance,Law,"",Institutions / Administrative Arrangements,Economy-wide,01/06/2012|Law passed,Full text|https://climate-laws.org/rails/active_storage/blobs/eyJfcmFpbHMiOnsibWVzc2FnZSI6IkJBaHBBdTRHIiwiZXhwIjpudWxsLCJwdXIiOiJibG9iX2lkIn19--df8078c40ea3edc42d0c90874e0268e9db83a38e/f|,,"This law defines the fundamental objectives of governmental action with regard to sustainable development. It notably aims at specifying the related political tools, integrate sustainability principles in all public and private activities, come up with climate change specific tools, and create the conditions for rational and sustainable use of natural resources."
4953,Law n ° 2014-427 (Ivorian forestry code),legislative,Côte d'Ivoire,CIV,"",Adaptation;Mitigation,"Standards, obligations and norms|Regulation;Processes, plans and strategies|Governance",Law,"",Redd+ And Lulucf,Buildings;Environment;LULUCF,01/07/2014|Law passed,Full text|https://climate-laws.org/rails/active_storage/blobs/eyJfcmFpbHMiOnsibWVzc2FnZSI6IkJBaHBBdXdHIiwiZXhwIjpudWxsLCJwdXIiOiJibG9iX2lkIn19--47b6cf8cf4f3837d24bfe32ddca8e6a806b11ffe/f|,,"This law sets up the Ivorian Forestry Code in order to define sustainable management rules for the country's forests. The law notably aims at reinforcing the forests' contribution to sustainable development, preserve and value the biological diversity, and promote the active participation of local populations and NGOs to sustainable management of forests. The document specifies the different categorisations of forests (for biodiversity conservation, for sustainable commercial use)."
4954,Law No. 2015-537 (Agricultural Guidance of Cote d'Ivoire),legislative,Côte d'Ivoire,CIV,"",Adaptation;Mitigation,"Processes, plans and strategies|Governance",Law,"",Redd+ And Lulucf,Agriculture;LULUCF;Transport,01/07/2015|Law passed,Full text|https://climate-laws.org/rails/active_storage/blobs/eyJfcmFpbHMiOnsibWVzc2FnZSI6IkJBaHBBdTBHIiwiZXhwIjpudWxsLCJwdXIiOiJibG9iX2lkIn19--b9a36f3903bda1fc8fa2af2cc0782492bcf36e63/f|,,"This law precises the national agricultural development policy of Ivory Coast. It notably aims at developping an agriculture sector ensuring food sovereignty, good nutrition and good employment. The law's dispositions apply among others to agriculture, forestry, agroforestry, unless more specific documents apply. Sustainable land management is one of the core long-term objective.<br>&nbsp;<br>&nbsp;Art. 55 states that the State constitutes a reserve of pre-basic and basic seeds for each of the vegetable, animal, fishery, aquaculture and forestry productions that are seriously threatened by climatic hazards.<br>&nbsp;<br>&nbsp;As part of the program aimed at improving food sovereignty and security by mitigating the effects of climate change on agricultural and food production, the State and local authorities are carrying out rehabilita- tion of hydro-agricultural developments (art. 65)."
4955,Law No. 2014-132 relating to the code of electricity,legislative,Côte d'Ivoire,CIV,"",Mitigation,"Processes, plans and strategies|Governance",Law,"",Energy Supply,Energy,01/03/2014|Law passed,Full text|https://climate-laws.org/rails/active_storage/blobs/eyJfcmFpbHMiOnsibWVzc2FnZSI6IkJBaHBBdXNHIiwiZXhwIjpudWxsLCJwdXIiOiJibG9iX2lkIn19--0bf4af953ad498f67a4cf961d933301821561c72/f|,,"This law defines the general principles of organization, operation and development and sets specific rules for the electricity sector. It notably aims at 1) guaranteeing energy independence and security of electricity supply; 2) promoting the development of new and renewable energies; 3) develop electrical energy and promote access to this energy; 4) promoting energy management; 5) creating the economic conditions allowing the return on investment; 6) promoting consumer rights; and 7) promoting competition and the rights of operators.<br />
<br />
Art. 30 states that the conclusion of an agreement and the issuance of a prior authorization for the exercise of activities in the field of renewable energies must take into account in particular: 1) the social well-being of the populations; 2) national economic development; 3) coverage of national electricity needs; 4) national food security."
10338,Constitution of Côte d’Ivoire,legislative,Côte d'Ivoire,CIV,"",Mitigation,"",Constitution,"",Climate protection;Healthy environment,Economy-wide,08/11/2016|Constitution Adopted||,Full text|https://www.constituteproject.org/constitution/Cote_DIvoire_2016.pdf?lang=en|en,,"Côte d’Ivoire’s Constitution was established in 2016. This Constitution was drafted by a Panel of Experts appointed by the then President, Alassane Ouattara. The draft was presented to the National Assembly in 2016 for approval before heading to a constitutional referendum. The Assembly approved the draft in October that same year, with more than the qualified majority needed for this purpose. The Constitution was then approved in the subsequent constitutional referendum held later that same month by 93.42% of votes with a 42.42% turnout. In its article 28, the Constitution establishes that “[T]he State is committed to respecting the Constitution, human rights and public freedoms. It ensures awareness and dissemination of them among the population”.&nbsp;<br><br>The Constitution recognizes in article 27 the right to a healthy environment, although climate change is not addressed in this article. However, in its preamble, the Constitution includes a provision to express the country’s commitment to contribute to climate protection the following way: “We, the People of Côte d'Ivoire; […] Express our commitment to: […] contributing to climate protection and to maintaining a healthy environment for future generations; […]”."
1147,Law No. 14/003 on Protection of the Nature,legislative,Democratic Republic of Congo,COD,"",Mitigation,Capacity building|Governance;Subnational and citizen participation|Governance,Law,"",Redd+ And Lulucf,LULUCF;Transport,11/02/2014|Law passed,,,"The law aims to adapt the DRC legal order of protection of nature to modern principles on biological and genetic resources management and to requirements of international conventions, including among others the Treaty on protection and sustainable management of forestry ecosystems in Central Africa.<br />
<br />
The law mandates the government to take into account the potential value of forest carbon sequestration services for climate change mitigation while elaborating the National Strategy on Protection of Nature and the National Forestry Programme.<br />
<br />
The law further calls on the central and regional governments to adopt and implement policies, plans and programmes promoting the contribution of natural and biological resources and ecosystems to the economic growth, rural development, fight against poverty and regulation of the climate."
1148,Law No. 14/011 (Electricity Sector),legislative,Democratic Republic of Congo,COD,"",Mitigation,"Provision of climate funds|Direct Investment;Institutional mandates|Governance;Processes, plans and strategies|Governance",Law,"",Institutions / Administrative Arrangements;Energy Supply;Energy Demand,Energy,17/06/2014|Law passed,,,"The objectives of this law include consolidating laws relating to generation, transmission, distribution, trading and use of electricity and promoting competition in the sector, as well as promoting energy efficiency and environmentally sound policy. It also aims at increasing access to energy in rural areas and secondary cities.<br />
The law creates a National Electrification Agency and a National Electrification Fund."
1150,Law No. 11/022 (Fundamental Agricultural Law),legislative,Democratic Republic of Congo,COD,"",Mitigation,"Institutional mandates|Governance;Processes, plans and strategies|Governance",Law,"",Research And Development;Energy Supply;Redd+ And Lulucf,Agriculture;Energy;LULUCF,24/12/2011|Law passed,,,"Given the huge dependence of the largely rural population on agriculture, this law attempts to support sustainable development; improve agricultural production and provide food self-sufficiency. The purpose of the Law is to promote and increase agricultural production to ensure food security and rural development. Its provisions apply to exploitation; agricultural training and research; financing of agricultural activities; sale of agricultural products; protection of environment; tax and customs regimes; etc. The Law sets a decentralised institutional framework to govern the agricultural policy and creates agricultural advisory boards at the national, provincial and local levels.<br />
<br />
While these aspects of the law are relevant to climate change with regard to land management and land use change (LULUCF), of particular importance is the stated goal of attracting new technology for sustainable energy production, specifically bioenergy and biogas to help shift the energy mix further towards renewable energy"
4956,Law No. 32/AN/13/ 7th L establishing the Djibouti Office of Geothermal Energy Development (ODDEG),legislative,Djibouti,DJI,"",Mitigation,"Institutional mandates|Governance;Processes, plans and strategies|Governance",Law,"",Institutions / Administrative Arrangements;Energy Supply,Energy;Industry,20/01/2014|Law passed,Full text|https://climate-laws.org/rails/active_storage/blobs/eyJfcmFpbHMiOnsibWVzc2FnZSI6IkJBaHBBdW9HIiwiZXhwIjpudWxsLCJwdXIiOiJibG9iX2lkIn19--9ec1a64a0499b72dd914b70a9ed887c285f98724/f|,,"This law creates the Djibouti Office of Geothermal Energy Development, which is supervised by the presidency of the republic. The Office is in charge of 1) Identification of the various types of geothermal resources of the country (high and low energy); 2) Conducting exploration, reconnaissance and studies; 3) Pre-feasibility and feasibility studies aimed at the industrial development of these resources and the diversification of their uses; and 4) The identification, with the appropriate partners, of public and private operators likely to ensure the development of geothermal energy production, and any associated products.<br />
<br />
The Office can further work on the following tasks: 1) Ensure greater energy independence and make geothermal energy a basic source in the country's energy mix; 2) Orientation and animation of technological research, initial and continuing training; 3) The development, demonstration and dissemination of applicable techniques; (4) The performance of any construction or work of works relating to its object; - Data collection, information and advice to public and private persons; 5) Participation in the development and implementation of international and bilateral cooperation agreements in relation to its prerogatives; 6) Keep the concerned administrations, and in particular Djibouti Electricity EDD, informed of its projects."
4957,Law no. 90-AN-15-7th L establishing the legislative framework relating to energy efficiency,legislative,Djibouti,DJI,"",Mitigation,"Processes, plans and strategies|Governance",Law,"",Energy Demand,Energy;Social development;Transport,01/07/2015|Law passed,Full text|https://climate-laws.org/rails/active_storage/blobs/eyJfcmFpbHMiOnsibWVzc2FnZSI6IkJBaHBBdWtHIiwiZXhwIjpudWxsLCJwdXIiOiJibG9iX2lkIn19--6f4ed1aec5d6a6f47561c304a2fda226e398173c/f|,,"This law establishes a framework legal framework in the field of energy efficiency in the Republic of Djibouti. Energy efficiency is recognized by the State of Djibouti as a national priority insofar as it is part of an approach of national independence and sustainable economic and social development respectful of the environment.<br />
<br />
Public and private establishments, whose total primary energy consumption exceeds a threshold set by decree, are subject to the compulsory and periodic energy audit carried out, under the authority of ADME, by an accredited expert auditor. Besides, new energy-consuming projects as well as expansion projects for energy-consuming establishments with a significant energy impact at the national level must be submitted before their completion, to the consultation of the Djiboutian Agency for Energy Management. to improve their energy efficiency."
