Id,Title,Type,Geography,Geography ISO,Frameworks,Responses,Instruments,Document Types,Natural Hazards,Keywords,Sectors,Events,Documents,Parent Legislation,Description
1549,Philippine Disaster Reduction and Management Act (RA 10121),legislative,Philippines,PHL,"",Adaptation;Disaster Risk Management,"Early warning systems|Direct Investment;Capacity building|Governance;Institutional mandates|Governance;Processes, plans and strategies|Governance;Subnational and citizen participation|Governance",Law,"",Adaptation;Institutions / Administrative Arrangements,Buildings;Health,27/05/2010|Law passed||,Full text|https://climate-laws.org/rails/active_storage/blobs/eyJfcmFpbHMiOnsibWVzc2FnZSI6IkJBaHBBZzBKIiwiZXhwIjpudWxsLCJwdXIiOiJibG9iX2lkIn19--3ebb8152699fd8ae53bebde5ea5d577a0182c72d/f|,,"The Act shifted the policy environment and the way the country deals with disasters from mere response to preparedness. RA 10121 provides a comprehensive, all-hazard, multi-sectoral, inter-agency, and community-based approach to disaster risk management through the formulation of the National Disaster Risk Management Framework.<br>&nbsp;<br>&nbsp;A National Disaster Risk Management Plan (NDRMP) is being formulated, developed, and implemented as the master plan that will provide the strategies, organisation, tasks of concerned agencies and local government units, and other guidelines in dealing with disasters or emergencies. Through this plan, a coherent, integrated, efficient, and responsive disaster risk management at all levels will hopefully be achieved.<br>&nbsp;<br>&nbsp;The law also promotes the development of capacities in disaster management at the individual, organisational, and institutional levels. A very important feature of this law is its call for the mainstreaming of disaster risk reduction in physical and land-use planning, budget, infrastructure, education, health, environment, housing, and other sectors.<br>&nbsp;<br>&nbsp;RA 10121 also recognises local risk patterns and trends and decentralisation of resources and responsibilities and thus encourages the participation of NGOs, private sectors, community-based organisations, and community members in disaster management. It inhibits the full participation of the Local Government Units (LGUs) and communities in governance. The approach tends to be 'response-oriented' or 'reactive.' This is evidenced by the widespread emphasis on post-disaster relief and short-term preparedness, such as forecasting and evacuation, rather than on mitigation and post- disaster support for economic recovery.<br>&nbsp;<br>&nbsp;Moreover, the Act mandates the establishment of a Disaster Risk Reduction and Management Office (DRRMO) in every province, city and municipality, and a Barangay Disaster Risk Reduction and Management Committee (BDRRMC) in every barangay.<br>&nbsp;<br>&nbsp;The Strategic National Action Plan on Disaster Risk Reduction for 2009-2019 aims to enhance the capacities of Local Disaster Risk Reduction and Management Councils.<br>&nbsp;<br>&nbsp;Finally, RA10121 provides for the calamity fund to be used in support of disaster risk reduction or mitigation, prevention, and preparedness activities for the potential occurrence of disasters and not just for response, relief, and rehabilitation efforts."
1552,"The Climate Change Act (RA 9729), and its Implementing Rules and Regulations (IRR, Administrative Order No. 2010-01)",legislative,Philippines,PHL,Adaptation;Mitigation,Adaptation;Disaster Risk Management;Mitigation,"Processes, plans and strategies|Governance;Research & Development, knowledge generation|Information",Law,Fires;Floods;Droughts;Sea level rise;Cyclones;Tsunamis;Storms;Hurricanes;Changes in average temperature,Adaptation;Institutions / Administrative Arrangements;Research And Development;Energy Supply;Energy Demand;Redd+ And Lulucf;Transport,Agriculture;Buildings;Health;LULUCF;Water,27/07/2009|Law passed||;20/01/2010|Law published||,Full text|https://climate-laws.org/rails/active_storage/blobs/eyJfcmFpbHMiOnsibWVzc2FnZSI6IkJBaHBBbzBHIiwiZXhwIjpudWxsLCJwdXIiOiJibG9iX2lkIn19--80bbdf505f7eef690fe77f2ecc89bdc20507b2f3/f|;Full text - part 2|https://climate-laws.org/rails/active_storage/blobs/eyJfcmFpbHMiOnsibWVzc2FnZSI6IkJBaHBBbzRHIiwiZXhwIjpudWxsLCJwdXIiOiJibG9iX2lkIn19--321e8ab05896fc734ba2c79b4e7d49eb07f84809/f|,,"The Act acknowledges the Philippines' vulnerability to climate change and the need for appropriate adaptation. It creates a comprehensive framework for systematically integrating the concept of climate change, in synergy with disaster risk reduction, in various phases of policy formulation, development plans, poverty reduction strategies and other development tools and techniques.<br>&nbsp;<br>&nbsp;The Act states the main principles of climate change policy: common but differentiated responsibilities; the Precautionary Principle; UNFCCC objectives (GHG mitigation and adaptation), and the Hyogo Framework for Action addressing disaster risk reduction. It adopts a gender-sensitive, pro-children and pro-poor approach.<br>&nbsp;<br>&nbsp;The Act establishes the Climate Change Commission as the sole policy-making body within government, which overseas, co-ordinates and evaluates climate change policies and plans. The commission is established under the office of the President (abolishing the Presidential Task Force on Climate Change, established in 2007) and has a diverse advisory board composed of government ministries and agencies.<br>&nbsp;<br>&nbsp;The Act requires the Commission to draft several policies:<br>&nbsp;- A National Climate Change Framework, as a basis for research and action planning<br>&nbsp;- A detailed National Climate Change Action Plan<br>&nbsp;- A Local Climate Change Action Plan - guidelines developed by the Commission<br>&nbsp;<br>&nbsp;Additional powers and functions include:<br>&nbsp;- Mainstreaming of climate change, in synergy with disaster risk reduction, into the national, sectoral and local development plans and programmes and co-ordinating climate change programmes of national government agencies<br>&nbsp;- Recommending legislation, policies, strategies, programmes on adaptation and mitigation<br>&nbsp;- Recommending key development investments in climate-sensitive sectors such as water resources, agriculture, forestry, coastal and marine resources, health and infrastructure<br>&nbsp;- Creating an enabling environment for the design of relevant and appropriate risk-sharing and risk-transfer instruments and promotion of broader multi-stakeholder participation and integrate climate change mitigation and adaptation<br>&nbsp;- Representing the Philippines in the climate change negotiations<br>&nbsp;- Formulating and implementing guidelines for determining vulnerability to climate change impacts and adaptation assessments<br>&nbsp;- Facilitating capacity building for local adaptation planning, implementation and monitoring of climate change initiatives in vulnerable communities and areas."
1553,Renewable Energy Act (RA9513) and corresponding circular DC2015-07-0014,legislative,Philippines,PHL,"",Mitigation,"Capacity building|Governance;Education, training and knowledge dissemination|Information",Law,"",Institutions / Administrative Arrangements;Energy Supply,Energy;Transport,16/12/2008|Approved by President||,Full text|https://climate-laws.org/rails/active_storage/blobs/eyJfcmFpbHMiOnsibWVzc2FnZSI6IkJBaHBBZ2tKIiwiZXhwIjpudWxsLCJwdXIiOiJibG9iX2lkIn19--46418d090212aeddd7315539e3a0805bf3d2293e/f|;Full text Circular  (PDF) |https://climate-laws.org/rails/active_storage/blobs/eyJfcmFpbHMiOnsibWVzc2FnZSI6IkJBaHBBdWtNIiwiZXhwIjpudWxsLCJwdXIiOiJibG9iX2lkIn19--9d9f9c4f5e170d8aca80ba9a3f57f0bea080c0af/2015%20DoE%20DC%202015-07-0014%20Renewable%20Energy%20Share%20in%20Installed%20Capacity%20Circular.pdf|en,,"This Act, overseen by the Department of Energy, employs various instruments to encourage the supply of electricity from renewable sources.<br>&nbsp;<br>&nbsp;The Act creates a Renewable Portfolio Standard for electricity generation from renewable sources, setting a minimum percentage of renewables supply for every electricity supplier.<br>&nbsp;<br>&nbsp;A feed-in tariff is introduced, which includes priority connection to the grid of all renewable sources, as well as priority purchase and transmission.<br>&nbsp;<br>&nbsp;Additional incentives are also offered to suppliers, manufacturers of equipment who are registered with the DOE, in order to encourage renewable energy projects. These include, among others, duty-free import of machinery, equipment and materials in the first 10 years of registration; tax caps of 15% on renewable energy equipment, accelerated depreciation scheme, cash incentives for missionary electrification, tax exemption of carbon credits and tax credit on domestic capital equipment services.<br>&nbsp;<br>&nbsp;The Act creates the National Renewable Energy Board (NREB) to facilitate implementation of the National Renewable Energy Programme.<br><br>Circular DC2015-07-0014 prescribes the policy for maintaining the share of renewable energy resources in the country's intalled capacity through the wholistic implementation of the Renewable Energy Act NO.9513."
1554,Biofuels Acts RA 9367 and amending Act RA 10745,legislative,Philippines,PHL,"",Mitigation,"Capacity building|Governance;Processes, plans and strategies|Governance",Law,"",Institutions / Administrative Arrangements;Research And Development;Energy Supply;Renewables;Biofuels,Energy;Waste;Water,17/05/2006|Approved||;12/01/2007|Law passed||;06/02/2011|Approved||;27/07/2015|Law passed||;24/06/2016|Approved||,Full text RA 9367|https://climate-laws.org/rails/active_storage/blobs/eyJfcmFpbHMiOnsibWVzc2FnZSI6IkJBaHBBZ2NKIiwiZXhwIjpudWxsLCJwdXIiOiJibG9iX2lkIn19--e818b07784c3dd8f643fbf51153089e9083fff31/f|en;Full text RA 10745 (WORD)|https://climate-laws.org/rails/active_storage/blobs/eyJfcmFpbHMiOnsibWVzc2FnZSI6IkJBaHBBdk1NIiwiZXhwIjpudWxsLCJwdXIiOiJibG9iX2lkIn19--33046e18a3a399d644fe63c6d8a4c5c53f91059f/2016%20RA%2010745%20Amended%20Biofuels%20Act%20of%202006(1).docx|en;Full text DC 2007-05-0006 (PDF) |https://climate-laws.org/rails/active_storage/blobs/eyJfcmFpbHMiOnsibWVzc2FnZSI6IkJBaHBBdlFNIiwiZXhwIjpudWxsLCJwdXIiOiJibG9iX2lkIn19--c4e49d74ada8b950783da707c0492e3fa17ba5c4/2007%20DoE%20DC%202007-05-0006%20Biofuels%20Act%20IRR.pdf|en;Full text DC 2011-02-0001 (PDF)|https://climate-laws.org/rails/active_storage/blobs/eyJfcmFpbHMiOnsibWVzc2FnZSI6IkJBaHBBdlVNIiwiZXhwIjpudWxsLCJwdXIiOiJibG9iX2lkIn19--9a11c773695cffcf195c666a59f9cd193fd82772/2011%20DoE%20DC%202011-02-0001%20Mandatory%20Use%20of%20Biofuel%20Blend.pdf|en;Full text DC  2016-07-0012 (PDF)|https://climate-laws.org/rails/active_storage/blobs/eyJfcmFpbHMiOnsibWVzc2FnZSI6IkJBaHBBdllNIiwiZXhwIjpudWxsLCJwdXIiOiJibG9iX2lkIn19--964ed82602e8d1ed76f79e9201ba3b156fa23624/2016%20DoE%20DC%202016-07-0012%20Amended%20Biofuels%20Act%20of%202006%20IRR.pdf|en,,"The Act introduces mandatory use of biofuels in the fuel mix, as follows: a minimum 5% of bioethanol in the gasoline mix sold and distributed within 2 years; a minimum of 10% within 4 years is required. There is priority for locally produced bioethanol, and only in the case of shortage may it be imported. The Act also requires a minimum of 1% of biodiesel in the diesel mix within 1 year, and a minimum of 2% within 2 years.<br>&nbsp;<br>&nbsp;Incentives are introduced to encourage biofuel projects - no specific tax on local or imported biofuels; exemption of raw materials (such as coconut, jatropha, cassava, corn, sugarcane etc.) from VAT; exemption from wastewater charges on water effluents; financial assistance to biofuel activities which are certified by the DOE and at least 60% of which are held by Filipino citizens or entities.<br>&nbsp;<br>&nbsp;The DOE is required to prepare a National Biofuel Programme; a national biofuel board is created under the Act, to monitor and evaluate the Act and the National Programme's implementation. The supply and price stability of sugar are guaranteed under the Act.<br>&nbsp;<br>&nbsp;A Joint Administrative order, which was published in 2008, outlines Guidelines Governing the Biofuel Feedstocks Production, and Biofuels and Biofuel Blends Production, Distribution and Sale under the Biofuels Act.<br><br>The Departement Circular No.2007-05-0006 known as the Implementing Rules and Regulations (IRR) for Republic Act No.9367 covers the production, blending, storage, handling, transport, distribution, use and sale of biofuels, biofuels-blends and biofuel feedstock in the Philippines.&nbsp;<br><br>The Department Circular No.2011-02-0001 on the Mandatory use of biofuel blend mandates the use of biofuels as a measure to develop and use indigenous renewable and sustainably-sourced clean energy sources to reduce dependence on imported oil, mitigate toxic and greenhouse gas emissions, increase rural employment and ensure availability of renewable clean energy without any detriment to the natural ecosystem, biodiversity and food reserves of the country. &nbsp;<br><br>The Republic Act No.10745 amends the Biofuels Act of 2006 by allowing natural gas power generating plants in the country to use neat diesel as an alternative fuel exempting them from the requirements of paragraph 5.3, section 5 of the Biofuels Act of 2006.&nbsp;<br><br>The Department Cicular No. 2016-07-0013 known as the Implementing Rules and Regulations for Republic Act No.10745 covers the power generating plants in the country using natural gas as its fuel. The DC provides for the exemption of natural gas power plans in using the mandated biodiesel blend as provided under the RA 9367.&nbsp;"
1558,Mini-hydroelectric Power Incentive Act (RA 7156),legislative,Philippines,PHL,"",Adaptation;Mitigation,"Tax incentives|Economic;Processes, plans and strategies|Governance",Law,"",Energy Supply,Energy,12/09/1991|Law passed,Full text|https://climate-laws.org/rails/active_storage/blobs/eyJfcmFpbHMiOnsibWVzc2FnZSI6IkJBaHBBZ01KIiwiZXhwIjpudWxsLCJwdXIiOiJibG9iX2lkIn19--ca9d28b7d7a468c0cd73703dd3c81bcaf3cbe951/f|,,"RA 7156 aims to strengthen and enhance the development of the country's indigenous and self-reliant scientific and technological resources and capabilities and their adaptation to the country in order to attain energy self-sufficiency and thereby minimise dependence on outside source of energy supply. To this end, mini-hydroelectric power developers shall be granted the necessary incentives and privileges to provide an environment conducive to the development of the country's hydroelectric power resources to their full potential.<br />
<br />
The Office of Energy Affairs is responsible for the regulation, promotion and administration of mini-hydroelectric power development and the implementation of the provisions of this Act. The mini-hydroelectric power developer must first offer to sell electric power to the National Power Corporation, franchised private electric utilities or electric co-operatives.<br />
<br />
Mini-hydroelectric power developers shall be granted the following tax incentives or privileges: (1) special privilege tax rates to develop potential sites for hydroelectric power and to generate, transmit and sell electric power; (2) tax and duty-free importation of machinery, equipment and materials; (3) tax credit on domestic capital equipment; (4) special realty tax rates on equipment and machinery; (5) value-added tax exemption; and (6) income tax holiday."
9648,Philippine Green Jobs Act no 10771/2016,legislative,Philippines,PHL,"",Mitigation,Subsidies|Economic;Tax incentives|Economic,Act,"",Tax incentives;jobs,Economy-wide,27/07/2015|Passed||,Full text (WORD)|https://climate-laws.org/rails/active_storage/blobs/eyJfcmFpbHMiOnsibWVzc2FnZSI6IkJBaHBBdThNIiwiZXhwIjpudWxsLCJwdXIiOiJibG9iX2lkIn19--bd2073aa608e447321f5c06ee0df389e7a7e2f3e/2016%20RA%2010771%20Philippine%20Green%20Jobs%20Act%20of%202016.rtf|en,,"The Philippine Green Jobs Act stipulates that the State shall identify needed skills, develop training programs, train and certify workers for jobs in a range of industries that produce goods and render services for the benefit of the environment, conserve natural resources for the future generation and ensure the sustainable development of the country and its transition into a green economy.<br><br>For this purpose, the act sets out several incentives to encourage business enterprises to generate green jobs as certified by the Climate Change Commission.&nbsp;"
9718,Republic Act no 11494 providing for COVID-19 response and economic recovery,legislative,Philippines,PHL,"",Mitigation,"Standards, obligations and norms|Regulation;Zoning & Spatial Planning|Regulation;Subsidies|Economic",Act,"",covid19;Stimulus plan,Economy-wide;Health;Transport,11/09/2020|Approved||,Full text (PDF)|https://climate-laws.org/rails/active_storage/blobs/eyJfcmFpbHMiOnsibWVzc2FnZSI6IkJBaHBBaHdOIiwiZXhwIjpudWxsLCJwdXIiOiJibG9iX2lkIn19--e7b6214cdc93e2e6225fca60a319ee9ee686779c/20200911-RA-11494-RRD.pdf|en,,"This document sets the Philippines' legislative response to COVID-19 and a recovery plan.<br><br>The Act notably aims to ""accommodate alternative modes of transport, including a network of bicycle lanes in every city"". Cycling measures are detailed at page 23 (pop-up bike lanes, supporting sharing schemes)."
10157,Republic Act No. 11285 (Energy Efficiency and Conservation Act),legislative,Philippines,PHL,"",Mitigation,"Subsidies|Economic;Processes, plans and strategies|Governance",Act,"",Energy Demand;energy conservation,Energy,12/04/2021|Act adopted||,Full text law|https://www.doe.gov.ph/sites/default/files/pdf/issuances/ra-11285-enercon-act.pdf|en,,"This Act, approved on 12 April 2019, sets out plans to increase energy efficiency and reduce consumption within the Philippines. Certain provisions<br><br>The law is to be implemented by the Department of Energy and the legislation provides for various new mandates of the department, as well as imposing responsibilities on other government bodies. An inter-agency committee on Energy efficiency is created. The act also provides for the creation of new performance and labelling standards, to be developed by the Department of Energy. The Act also contains provisions regarding financial and other incentives and encourages the provisions of concessionary finance for energy efficiency measures."
8552,Environmental Protection Law and Decree no 30 promulgating it,legislative,Qatar,QAT,"",Mitigation,"Processes, plans and strategies|Governance",Law,"",Institutions / Administrative Arrangements,Agriculture;Environment;Health;Industry;Transport,25/12/2002|Law passed||,Full text|https://climate-laws.org/rails/active_storage/blobs/eyJfcmFpbHMiOnsibWVzc2FnZSI6IkJBaHBBa0FHIiwiZXhwIjpudWxsLCJwdXIiOiJibG9iX2lkIn19--673dd64777ede048055c4768b813b3eeab2897c6/x|,,"<br>&nbsp;<br>&nbsp;<br>&nbsp;<br>&nbsp;The Environmental Protection Law aims at protecting and preserving the quality and natural balance of the Qatari environment, to develop natural resources and protect biodiversity, to protect the population and human health, and to protect the environment from the harmful impact of activities happening abroad. The Law also aims at combating ""the effects of pollution in its various forms, and prevent damage as well as instant and long-term environmental effects of construction, industrial, agricultural and economical activities.' The country's mitigation efforts, including carbon capture and storage, are regulated by this law.<br>&nbsp;<br>&nbsp;<br>&nbsp;<br><br>"
1601,"Law No. 16 of 22 May 2012, determining the Organisation, Functioning and Mission of the National Fund for Environment (FONERWA)",legislative,Rwanda,RWA,"",Adaptation;Mitigation,"Provision of climate funds|Direct Investment;Processes, plans and strategies|Governance",Law,"",Institutions / Administrative Arrangements;Research And Development,Energy,25/06/2012|Law passed,Full text|https://climate-laws.org/rails/active_storage/blobs/eyJfcmFpbHMiOnsibWVzc2FnZSI6IkJBaHBBdUFJIiwiZXhwIjpudWxsLCJwdXIiOiJibG9iX2lkIn19--0c361320bc2f32cd6aff85d7cd21dc28994d2167/f|,,"This Law determines the organisation, functioning and mission of the National Fund for Environment in Rwanda (FONERWA). The fund will be the primary instrument to channel, distribute and monitor international and national climate finance.<br />
<br />
FONERWA has four finance windows: conservation and sustainable management of natural resources; R&D and technology transfer; streamlining of climate change issues into policies and programmes; and Environmental Impact Assessment (EIA) monitoring & enforcement."
1603,Ministerial Order No. 003/16.01 of 15 July 2010 Preventing Activities that Pollute the Atmosphere,legislative,Rwanda,RWA,"",Mitigation,"Standards, obligations and norms|Regulation",Law,"",Energy Supply,Agriculture,30/08/2010|Law passed,Full text|https://climate-laws.org/rails/active_storage/blobs/eyJfcmFpbHMiOnsibWVzc2FnZSI6IkJBaHBBdDhJIiwiZXhwIjpudWxsLCJwdXIiOiJibG9iX2lkIn19--a3f68086b0375cf597a3f4e8c7266d2e7ff1053a/f|,,"This Ministerial Order regulates activities that give rise to chemical pollutants. Annex A specifies emission standards for CO2, along with other pollutants (such as NOx, SOx, PM10, Lead and Ozone).<br />
It prohibits open burning of any substance, except for fires used for recreational purposes and ceremonial; fires purposely set for agricultural control of disease and pests; and open air, kitchen fires for cooking meals."
1604,"Organic Law 4/2005 determining the modalities of protection, conservation and promotion of environment in Rwanda",legislative,Rwanda,RWA,"",Disaster Risk Management,"Provision of climate funds|Direct Investment;Early warning systems|Direct Investment;Processes, plans and strategies|Governance",Law,"",Institutions / Administrative Arrangements,Environment;Water,01/05/2005|Law passed,Full text|https://climate-laws.org/rails/active_storage/blobs/eyJfcmFpbHMiOnsibWVzc2FnZSI6IkJBaHBBdHdJIiwiZXhwIjpudWxsLCJwdXIiOiJibG9iX2lkIn19--4bb0adcb604c7287090f20c9c0b324643e8e1d00/f|,,"This law gives effect to The National Policy on Environment, which sets out how to protect, conserve and promote the environment. It defines the responsibilities of citizen and state and defines principles for using natural resources, such as air and water, protecting biodiversity etc. It orders an environmental impact assessment.<br />
<br />
Article 27 states that 'the use of substances that pollute the atmosphere…, that deplete the ozone layer or that may cause climatic changes is governed by an order of the Minister having environment in his or her attributions.'<br />
<br />
The National Policy includes suggested policy statements on several areas, which can be used as an entry point for more elaborated policies. The Policy Statement on Atmosphere, Climate and Disasters declares two objectives: to help establish a framework for early warning and management of natural and/or human-made disasters; and to help establish a policy and legislation to monitor regularly climatic change and reduce to a strict minimum substances that pollute the atmosphere.<br />
<br />
The law provides for the establishment of a National Fund for Environment (FONERWA)."
8580,"Law no 63/2013 determining the mission, organization and functioning of Rwanda Environment Management Authority",legislative,Rwanda,RWA,"",Adaptation,"",Law,"",Adaptation;Institutions / Administrative Arrangements,"",27/08/2013|Law passed,"Full text|http://rema.gov.rw/rema_doc/Laws/Itegeko%20rishya%20rya%20REMA.pdf(6-mar-18),http://www.lse.ac.uk/GranthamInstitute/rwanda-law-itegeko-rishya-rya-rema/(6-mar-18)|",,"<br />
<br />
<br />
<br />
<br />
<br />
<br />
Law no 63/2013 determines the mission, organisation and functioning of the Rwanda Environment Management Authority (REMA). The Authority shall have legal personality, administrative and financial autonomy and shall be governed in accordance with laws governing public institutions. This Law repeals Law n0 16/2006 of 03-Apr-06 which determined the organization, functioning and responsibilities of the Rwanda Environment Management Authority.<br />
<br />
<br />
<br />
<br />
Art 3.4 of the present law missions REMA to put in place measures designed to prevent climate change and cope with its impacts.<br />
<br />
<br />
<br />
<br />
<br />
<br />
<br />
<br />
<br />
<br />
<br />"
9428,Law N°48/2018 on the environment,legislative,Rwanda,RWA,"",Adaptation;Mitigation,"Processes, plans and strategies|Governance;Subnational and citizen participation|Governance;MRV|Governance",Law,"",Energy Supply;Waste;Climate Change,Economy-wide,13/08/2018|Law Passed||,Link to the full text (pdf)|https://waterportal.rwb.rw/sites/default/files/2018-10/Water%20law%20gazetted%2C2018.pdf|en,,"This Law determines modalities for protecting, conserving and promoting the environment against climate change.<br><br>The law establishes 1) the conservation and the protection of the natural environment (soil, water resources, biodiversity, atmosphere, etc), 2) obligations to the state, decentralised entities and local communities with regard to the protection and promotion of environment, 3) the inspection and criminal investigation power in environmental matters.<br><br><br>"
