Id,Title,Type,Geography,Geography ISO,Frameworks,Responses,Instruments,Document Types,Natural Hazards,Keywords,Sectors,Events,Documents,Parent Legislation,Description
10149,Environmental Management and Coordination (Amendment) Act (EMCA),legislative,Kenya,KEN,"",Disaster Risk Management;Mitigation,Capacity building|Governance;Institutional mandates|Governance,Act,Flood,Renewables;afforestation,Environment,25/12/1999|Passed||;25/06/2015|Amended||,Link to full text (2012 version)|http://extwprlegs1.fao.org/docs/pdf/ken41653.pdf|en;Link to full text of 2015 amendment act (PDF)|https://www.nema.go.ke/images/Docs/Legislation%20and%20Policies/EMCA%20Act%202015.pdf|en,,"This law provides for environmental protection in Kenya.&nbsp;<br><br>Article 49 promotes the use of renewable energy and the planting of trees. Article 57 grants the relevant ministry the possibility to allow fiscal incentives under the form of tax rebates for private entities ""that invest in plants, equipment and machinery for pollution control, re-cycling of wastes, water harvesting and conservation, prevention of floods and for using other energy resources as substitutes for hydrocarbons"".&nbsp;<br><br>Article 50 sets the legal framework to ensure the conservation of biological diversity, and charges the relevant agency to ""measure the value of unexploited natural resources in terms of watershed protection, influences on climate, cultural and aesthetic value, as well as actual and potential genetic value thereof."" The document also contains a number of dispositions to protect forests.&nbsp;<br><br>The 2015 law amends section 56.A and charges the cabinet secretary to prescribe measures on climate change."
8875,National Disaster Act 1993 (No. 12 of 1993),legislative,Kiribati,KIR,"",Adaptation;Disaster Risk Management,Capacity building|Governance;Institutional mandates|Governance,Law,"",Adaptation;Institutions / Administrative Arrangements;Disaster Risk Management,"",24/01/1994|Law passed||,Full text (PDF)|https://climate-laws.org/rails/active_storage/blobs/eyJfcmFpbHMiOnsibWVzc2FnZSI6IkJBaHBBaVVGIiwiZXhwIjpudWxsLCJwdXIiOiJibG9iX2lkIn19--065d63ae73fc3b011dd574ba09524ea1514b7526/f|,,"Kiribati's National Disaster Act creates a government obligation to undertake measures to mitigate, prepare for, respond to, and recover from disasters. In order to accomplish this, the law establishes the country's National Disaster Council, as well as several other government offices, which are responsible for disaster risk management in the country."
8524,Air pollution control Act,legislative,"Korea, North",PRK,"",Mitigation,"Processes, plans and strategies|Governance",Law,"",Energy Supply;Energy Demand,Energy;Health,12/07/2012|Law passed,full text (pdf)|http://www.lse.ac.uk/GranthamInstitute/wp-content/uploads/2018/02/law-on-air-pollution-protection-2012.pdf|ko,,"The present Law was adopted by Decree No. 2520 of the Presidium of the Supreme People's Assembly in 2012, and Amended by Decree No. 3292 of the Assembly Standing Committee on July 24th, 2013. The Law consists of a series of measures aiming at preventing and controlling air pollution levels to protect human and environmental health.<br>&nbsp;<br>&nbsp;The document specifies that the North Korean State encourages the gradual reduction in the use of fossil fuels, as they lead to air pollution and climate change. The State further encourages the development and use of renewables sources, including hydro, wind, solar, geothermal and biofuels. The State also seeks the participation of the North Korean people in projects that protect the atmosphere.<br>&nbsp;<br><br>"
8525,Energy production Act,legislative,"Korea, North",PRK,"",Mitigation,"Processes, plans and strategies|Governance",Law,"",Energy Supply,Energy,20/12/1995|Law passed,full text (pdf)|http://www.lse.ac.uk/GranthamInstitute/wp-content/uploads/2018/02/PRKlaw-on-electric-power.pdf|ko,,"The Law on energy production is a general document that legally frames the country's energy sector. It was adopted through Decision no. 65 of the Standing Committee of the Supreme People's Assembly in 1995 and amended in 1999, 2001, 2006, 2008 and 2015. The Law mentions that the country new power plants being built by the country will include projects using wind, geothermal and solar sources. Article 8 also seeks increased energy efficiency."
8527,Small and Medium-sized Power Plant Act,legislative,"Korea, North",PRK,"",Mitigation,"Processes, plans and strategies|Governance",Law,"",Institutions / Administrative Arrangements;Energy Supply,Energy,11/04/2007|Law passed,full text (pdf)|http://www.lse.ac.uk/GranthamInstitute/wp-content/uploads/2018/02/PRKlaw-on-medium-and-small-power-plant-2007.pdf|ko,,"The Small and Medium-sized Power Plant Act was implemented in 2007 to ensure the power sector meets North Korea's energy demand. The Act's objective is to set an institutional framework over the country's power sector. The capacity of regulated plants can go up to 20 MW, and specifies the inclusion of thermal, hydro and wind resources.<br>&nbsp;<br><br>"
8528,Renewable Energy Act,legislative,"Korea, North",PRK,"",Mitigation,"Subsidies|Economic;Tax incentives|Economic;Provision of climate funds|Direct Investment;Capacity building|Governance;Research & Development, knowledge generation|Information",Law,"",Institutions / Administrative Arrangements;Energy Supply;Energy Demand,Energy,29/05/2013|Law passed,full text (pdf)|http://www.lse.ac.uk/GranthamInstitute/wp-content/uploads/2018/02/law-on-renewable-energy.pdf|ko,,"The Renewable Energy Act encourages the development of the renewable energy sector and of the institutional framework to accompany such developments. ""Regenerative energy"" is defined here as renewable sources including solar, wind, geothermal, biomass and marine.<br>&nbsp;<br>&nbsp;The Act encourages State's investments in the sector to reduce costs and improve efficiency, and charges the National Planning Agency, the Central Science and Technology Administrative Guidance organ, other organisations and enterprises to establish a prospective development and utilisation plan of renewable energy. The plan will be divided between production according to funding sources and use by different actors.<br>&nbsp;<br>&nbsp;The Act also seeks an increase use of renewable energy and missions the Central Science and Technology Administrative Guidance organ to develop targets accordingly.<br>&nbsp;<br><br>"
1432,Law No 21/1995 Kuwait Environment Public Authority. Further amended: Law No 16/1996,legislative,Kuwait,KWT,"",Mitigation,"Institutional mandates|Governance;Processes, plans and strategies|Governance",Law,"",Institutions / Administrative Arrangements,Energy,04/07/1995|Law passed;04/07/1996|Law amended,Full text|https://climate-laws.org/rails/active_storage/blobs/eyJfcmFpbHMiOnsibWVzc2FnZSI6IkJBaHBBbXNKIiwiZXhwIjpudWxsLCJwdXIiOiJibG9iX2lkIn19--ad9f2cc978ad8690f305ee3a913f6a82daac1c1a/f|,,"This is the main environmental law. It established the Kuwait Environment Public Authority and mandated it with jurisdiction and the powers to regulate practices that pollute the environment. KEPA can follow up on or evaluate impact assessment studies of projects, implement the polluter pays principle, promote the optimal use of oil resources, demand consumption reductions and energy saving technology in project design etc.<br />
<br />
The Law 16/1996 amendment clarified KEPA's role in conservation, protection and liability concepts."
4965,Environmental Protection Law (2013 version),legislative,Lao People's Democratic Republic,LAO,"",Mitigation,"Processes, plans and strategies|Governance",Law,"",Redd+ And Lulucf,"",01/01/2013|Law passed,Full text|https://climate-laws.org/rails/active_storage/blobs/eyJfcmFpbHMiOnsibWVzc2FnZSI6IkJBaHBBdUFHIiwiZXhwIjpudWxsLCJwdXIiOiJibG9iX2lkIn19--692490ad07c7842284636e204348d7334a70efe8/f|,,"This law defines the principles, regulations and measures related to management, monitoring protection, control, preservation and rehabilitation of the environment, as well as mitigation of anthropogenic impacts and pollutions. Adverse impacts on climate change are included in the scope of this law (art. 11).

Art. 19 on Strategic Environmental Assessment (SEA) specifies that climate effects should be estimated when developing projects that require an SEA.

Art. 20 sets that preventive measures should be undertaken, including tree plantations, construction of dykes and drainage canals."
8714,Eighth Five-Year National Socio-Economic Development Plan (2016-2020),legislative,Lao People's Democratic Republic,LAO,"",Adaptation;Disaster Risk Management,"Processes, plans and strategies|Governance",Plan,"",Adaptation;Carbon Pricing;Energy Supply;Redd+ And Lulucf,Agriculture;Energy;Transport,01/06/2016|Law passed,Full text|https://climate-laws.org/rails/active_storage/blobs/eyJfcmFpbHMiOnsibWVzc2FnZSI6IkJBaHBBdHNGIiwiZXhwIjpudWxsLCJwdXIiOiJibG9iX2lkIn19--75a6dd833740c417ad0bf47ff36287339d1159a2/f|,,"This Development Plan sets the national strategy to reach certain socio-economic targets over the period 2016-2020. It was officially approved at the VIIIth National Assembly's Inaugural Session in April 2016.

The Plan notably seeks to foster the country's mitigation and adaptation efforts, and to integrate these goals into sectoral strategic and operational plans. Part. 6.6.2 focuses on disaster risk management and adaptation. A list of sectoral and institutional actions to enable disaster risk management is laid out.

Priority mitigation activities include an enhancement of REDD+ projects to reduce emissions and the establishment of sustainable financial mechanisms. The government is encouraged to find a way to integrate REDD+ projects into international carbon trade mechanisms.

Aims for the agricultural sector include the development of cultivation areas for renewable energy crops such as oleaginous fruit trees.
<div class=""page"" title=""Page 150"">
<div class=""section"">
<div class=""layoutArea"">



</div>
</div>
</div>"
10199,Disaster Risk Management Law 15/2019,legislative,Lao People's Democratic Republic,LAO,"",Disaster Risk Management,Capacity building|Governance,Act,"","",Disaster Risk Management (Drm),24/06/2019|Approved||,Link to full text (PDF)|https://climate-laws.org/rails/active_storage/blobs/eyJfcmFpbHMiOnsibWVzc2FnZSI6IkJBaHBBazRPIiwiZXhwIjpudWxsLCJwdXIiOiJibG9iX2lkIn19--89b5cf7d95cedabde916d0bd6b25d77fddc1c9a8/Lao%20DRM%20law.pdf|,,This law sets the country's disaster risk management legal framework.
4966,Environment Act 2008 (No. 10 of 2008),legislative,Lesotho,LSO,"",Adaptation;Mitigation,"Processes, plans and strategies|Governance",Law,"",Redd+ And Lulucf,Economy-wide,25/12/2008|Law passed,Full text|https://climate-laws.org/rails/active_storage/blobs/eyJfcmFpbHMiOnsibWVzc2FnZSI6IkJBaHBBdDhHIiwiZXhwIjpudWxsLCJwdXIiOiJibG9iX2lkIn19--2f45748e849a0c100ee00ba4dd642a0c113d97d9/f|,,This Act establishes a legal framework related to the protection and management of environmental resources. Art. 3 (i) specifies that the authorities in charge should prevent any interference with the climate and take compensatory measures for such interferences.
4080,Environmental Protection and Management Law of the Republic of Liberia,legislative,Liberia,LBR,"",Mitigation,"Processes, plans and strategies|Governance",Law,"",Institutions / Administrative Arrangements;Research And Development;Energy Supply;Energy Demand;Redd+ And Lulucf,LULUCF;Water,26/11/2002|Law passed,Full text|https://climate-laws.org/rails/active_storage/blobs/eyJfcmFpbHMiOnsibWVzc2FnZSI6IkJBaHBBdFFIIiwiZXhwIjpudWxsLCJwdXIiOiJibG9iX2lkIn19--c1c50aefd4df69c5086965cef59db2296a02cfad/f|,,"This Act establishes a legal framework for the sustainable development, management and protection of the environment by the Environment Protection Agency in partnership with regulated Ministries and organizations, and to provide high quality information and advice on the state of the environment and for related matters. Section 77 on the protection of forest sets that guidelines issued by the Agency shall take into account the fact that forest land acts as sink for greenhouse gases. Part VII, section 83, 1.g) charges the Agency to measure the value of unexploited natural resources in terms of watershed protection an influences on climate and other potential genetic value. Section 89 insists on the role of rain forests as a sink for greenhouse gases."
8906,Act creating the Environment Protection Agency of the Republic of Liberia,legislative,Liberia,LBR,"",Adaptation;Mitigation,Provision of climate funds|Direct Investment;Institutional mandates|Governance;MRV|Governance,Act,"",Institutions / Administrative Arrangements,Economy-wide,26/11/2002|Law passed,Environment Protection Agency Act|https://climate-laws.org/rails/active_storage/blobs/eyJfcmFpbHMiOnsibWVzc2FnZSI6IkJBaHBBaEVGIiwiZXhwIjpudWxsLCJwdXIiOiJibG9iX2lkIn19--b824c246cb76560835353bf151c1754b63b36bf4/f|,,"This Act provides for the establishment of the Environment Protection Agency, the National Environment Policy Council, the Environmental Court of Appeals, the Environmental Administrative Court and the Environment Protection Fund, for the designation of Environmental Inspectors and other matters relative to administration in the field of environment, for environment impact assessment and monitoring and for environmental enforcement orders."
8640,Law No. 426 establishing the Renewable Energy Authority of Libya (REAOL),legislative,Libya,LBY,"",Mitigation,"Institutional mandates|Governance;Processes, plans and strategies|Governance",Law,"",Institutions / Administrative Arrangements,Energy,25/12/2007|Law passed,,,"This law creates the <a href=""http://auptde.org/default.aspx?lang=ar"">Renewable Energy Authority</a> of Libya (REAOL), in order to meet the governmental target of a 10 % share of the total energy mix coming from renewable energy sources by 2020. The Authority's mission is to implement renewable energy projects, encourage the private sector to engage in the market, edict a regulatory framework and identify priority areas."
1436,Law 2003-010 National Strategy for Disaster Risk Management,legislative,Madagascar,MDG,"",Adaptation;Disaster Risk Management,"Early warning systems|Direct Investment;Capacity building|Governance;Processes, plans and strategies|Governance;Subnational and citizen participation|Governance",Law,"",Adaptation;Institutions / Administrative Arrangements;Research And Development,"",20/08/2003|Law passed||,Full text|https://climate-laws.org/rails/active_storage/blobs/eyJfcmFpbHMiOnsibWVzc2FnZSI6IkJBaHBBbVVKIiwiZXhwIjpudWxsLCJwdXIiOiJibG9iX2lkIn19--02a9c940c780871bf240c60924c3b16079cbe8bb/f|,,"According to the law, risk management and disaster fits into the overall framework of activities relating to civil protection and security. The guiding principles are: guarantee the protection of the population and of the environment; improve the resilience of the population in cases of risks and catastrophes; and develop conditions to reduce the vulnerability of the population - although there is no explicit mention of climate change adaptation.<br>&nbsp;<br>&nbsp;The law provides mechanisms and measures to safeguard hazards and disasters. The strategy for DRC is based on preventive measures, warning, preparation, management, relief, recovery, reconstruction and development.<br>&nbsp;<br>&nbsp;The institutional structure for DRM activities includes: the National Council for Disaster Risk Management, a high level co-ordination and strategic decision-making body that is presided over by the Prime Minister and comprised of ministerial representatives; and the National Office for Disaster Risk Management, under the Ministry of Interior. The law calls for the decentralization of DRM responsibilities to the regional, district and commune level.<br>&nbsp;<br>&nbsp;The SNGRC is currently being revised."
9296,Law No. 2017-021 on the reform of the National Electricity Fund (FNE),legislative,Madagascar,MDG,"",Mitigation,"Provision of climate funds|Direct Investment;Processes, plans and strategies|Governance",Law,"",Energy Supply;Energy Demand,Energy;Urban,22/11/2017|Law passed,Full text (PDF)|https://climate-laws.org/rails/active_storage/blobs/eyJfcmFpbHMiOnsibWVzc2FnZSI6IkJBaHBBbllGIiwiZXhwIjpudWxsLCJwdXIiOiJibG9iX2lkIn19--1ac50cd5a419aaa19fcbc5cfad17f2f9ddef05f0/f|,,"This law introduces a reform of the National Fund of Electricity (FNE). It sets up a National Sustainable Energy Fund (FNED) intended to contribute to the financing of electricity infrastructure development projects in rural and peri-urban areas, based on renewable energies and the promotion of energy efficiency, and on from which financial aids and tools are taken for the operators holding Declarations, Authorization Contracts or Concessions."
9300,Law n ° 2015-031 on the National Policy of Risk Management and Catastrophes,legislative,Madagascar,MDG,"",Adaptation,"Processes, plans and strategies|Governance",Law,"",Adaptation;Institutions / Administrative Arrangements,"",04/12/2015|Law passed,Full text (PDF)|https://climate-laws.org/rails/active_storage/blobs/eyJfcmFpbHMiOnsibWVzc2FnZSI6IkJBaHBBbmNGIiwiZXhwIjpudWxsLCJwdXIiOiJibG9iX2lkIn19--b91b4585e435960e3cd47a8edd688f0d1776c962/f|,,"This Law defines the main objective of Risk and Disaster Management, its fundamental structures, and the principles governing the relations between the various stakeholders."
9304,Law No. 2013-002 (flood protection,legislative,Madagascar,MDG,"",Adaptation,"Processes, plans and strategies|Governance",Law,"",Adaptation;Water Management,"",02/08/2013|Law passed,Full text (PDF)|https://climate-laws.org/rails/active_storage/blobs/eyJfcmFpbHMiOnsibWVzc2FnZSI6IkJBaHBBbmtGIiwiZXhwIjpudWxsLCJwdXIiOiJibG9iX2lkIn19--fddc543d1223f4d68c6f74f0def11a8fe00ff284/f|,,"This Law amends the provisions of Articles 1, 2, 3, 5, 7, 9, 10, 13 and 15 of Law No. 95034 of 3 October 1995 in order to authorise the establishment of bodies responsible for flood protection and setting the fees for flood protection."
4119,Energy Regulation Act,legislative,Malawi,MWI,"",Mitigation,"Institutional mandates|Governance;Processes, plans and strategies|Governance",Law,"",Institutions / Administrative Arrangements;Energy Supply,Energy,19/03/2004|Law passed,Full text|https://climate-laws.org/rails/active_storage/blobs/eyJfcmFpbHMiOnsibWVzc2FnZSI6IkJBaHBBczhIIiwiZXhwIjpudWxsLCJwdXIiOiJibG9iX2lkIn19--4adc18243e708601e40f426b601592bdacbe06d0/f|,,"This Act establishes the Energy Regulatory Authority to regulate the energy sector, defines its functions and powers, and provide for licensing of energy undertakings. Members of the Authority should have adequate knowledge related renewable energy. The Authority shall notably promote energy efficiency and the exploitation of renewable resources.

The Authority is charged in art. 9.2.(i) to promote the exploitation of renewable energy resources, and (e) to promote energy efficiency and energy savings."
4120,Rural Electrification Act,legislative,Malawi,MWI,"",Mitigation,"Processes, plans and strategies|Governance",Law,"",Energy Supply,Energy;Rural,19/03/2004|Law passed,Full text|https://climate-laws.org/rails/active_storage/blobs/eyJfcmFpbHMiOnsibWVzc2FnZSI6IkJBaHBBczRIIiwiZXhwIjpudWxsLCJwdXIiOiJibG9iX2lkIn19--06dee4712be2ed93ceca92d9581d594e41cebb96/f|,,"This act makes provision for the promotion, funding, management and regulation of rural electrification. Specific, more favourable rules are laid out for renewable energy resources, including in terms of finance."
9210,Disaster Preparedness and Relief Act (Cap. 33:05),legislative,Malawi,MWI,"",Adaptation;Disaster Risk Management,Early warning systems|Direct Investment;Capacity building|Governance;Institutional mandates|Governance,Act,"",Adaptation,"",16/03/1992|Law passed||,full text (PDF)|https://climate-laws.org/rails/active_storage/blobs/eyJfcmFpbHMiOnsibWVzc2FnZSI6IkJBaHBBbHdGIiwiZXhwIjpudWxsLCJwdXIiOiJibG9iX2lkIn19--922eb4e83f7804d93de8053b5091131d432d3251/f|,,"This Act makes provision for the prevention of disasters in Malawi and for disaster preparedness and disaster mitigation. There shall be a Commissioner for Disaster Preparedness and Relief who shall, among other things: supervise the the establishment of civil protection organizations and civil protection areas and control and direct personnel, materials and services for the purposes of this Act. The Act provides for the establishment of the National Disaster Preparedness and Relief Committee of Malawi."
9212,Environment Management Act (No. 19 of 2017),legislative,Malawi,MWI,"",Adaptation;Mitigation,"Standards, obligations and norms|Regulation;Processes, plans and strategies|Governance",Act,"",Adaptation;Institutions / Administrative Arrangements;Mitigation,"",30/04/2017|Law passed,full text (PDF)|https://climate-laws.org/rails/active_storage/blobs/eyJfcmFpbHMiOnsibWVzc2FnZSI6IkJBaHBBbDBGIiwiZXhwIjpudWxsLCJwdXIiOiJibG9iX2lkIn19--21d464f3d98ec8888ebd20573cff121ee8876998/f|,,"This Act concerns the conservation and management of the environment in Malawi and prescribes environmental standards. It also concerns the conservation and management of biological (genetic) resources. The Act consists of 119 sections divided into 17 Parts, covering main areas of environmental concern, some of the areas covered are: the Environment Protection Authority; Environmental Planning; Environmental and social impact assessment, audits and monitoring; Environmental standards; Management of the Environment and Natural Resources; Pollution Control; The Environment Fund.
Climate Change is addressed in part VIII concerning management of the environment and natural resources."
1437,Renewable Energy Act 2011,legislative,Malaysia,MYS,"",Mitigation,Tax incentives|Economic,Law,"",Energy Supply,Energy,25/12/2011|Law passed,Full text (pdf)|https://climate-laws.org/rails/active_storage/blobs/eyJfcmFpbHMiOnsibWVzc2FnZSI6IkJBaHBBbVlKIiwiZXhwIjpudWxsLCJwdXIiOiJibG9iX2lkIn19--0ea7ef5dc724963eecd43b5c1c209b2d1cdcde10/f|en;Full text in Malay (pdf)|http://www.lse.ac.uk/GranthamInstitute/wp-content/uploads/laws/1437_amendment%202015.pdf|ms,,"The Renewable Energy Act 2011 establishes a system of feed-in tariffs for renewables. The system sets fixed tariff rates for electricity generated from solar, biomass, biogas, and hydro energy. Depending on the type of resource used, these tariffs are guaranteed for a period of 16 to 21 years."
1438,Sustainable Energy Development Authority Act 2011,legislative,Malaysia,MYS,"",Mitigation,Tax incentives|Economic;Institutional mandates|Governance,Law,"",Institutions / Administrative Arrangements;Research And Development;Energy Supply,Energy,25/12/2011|Law passed,Full text|https://climate-laws.org/rails/active_storage/blobs/eyJfcmFpbHMiOnsibWVzc2FnZSI6IkJBaHBBbVFKIiwiZXhwIjpudWxsLCJwdXIiOiJibG9iX2lkIn19--ad1068aa96ced1d4abca2d6774bab1b7685d91d7/f|,,The Sustainable Energy Development Authority Act 2011 created the Sustainable Energy Development Authority (SEDA). SEDA is charged with overseeing the implementation and operation of the renewable energy feed-in tariff system established under the Renewable Energy Act 2011.
1441,Malaysia Biofuels Industry Act 2007,legislative,Malaysia,MYS,"",Mitigation,"Processes, plans and strategies|Governance",Law,"",Institutions / Administrative Arrangements;Energy Supply,Transport,25/12/2007|Law passed;01/11/2012|Law amended,Full text|https://climate-laws.org/rails/active_storage/blobs/eyJfcmFpbHMiOnsibWVzc2FnZSI6IkJBaHBBbUlKIiwiZXhwIjpudWxsLCJwdXIiOiJibG9iX2lkIn19--ae5e5ca0ca6d678e1b0e24db79f36046de160086/f|,,"The Malaysia Biofuels Industry Act 2007 creates a blending mandate for palm oil biodiesel with petroleum diesel (B5 blend). Furthermore, the act establishes a regulatory regime for the licensing of blending, storage, transport, and export of biodiesel from palm oil."
1442,Electricity Supply Act 1990,legislative,Malaysia,MYS,"",Mitigation,"Standards, obligations and norms|Regulation;Processes, plans and strategies|Governance",Law,"",Institutions / Administrative Arrangements;Energy Demand,Energy;Industry,25/12/2010|Law passed||,Full text|https://climate-laws.org/rails/active_storage/blobs/eyJfcmFpbHMiOnsibWVzc2FnZSI6IkJBaHBBbDhKIiwiZXhwIjpudWxsLCJwdXIiOiJibG9iX2lkIn19--43849ea572ad088115abb568d774ff73bd56d51a/f|;Amendment|https://climate-laws.org/rails/active_storage/blobs/eyJfcmFpbHMiOnsibWVzc2FnZSI6IkJBaHBBbUFKIiwiZXhwIjpudWxsLCJwdXIiOiJibG9iX2lkIn19--b0cd58e70e40c9fb42db5532d18cc6068e9e9237/f|,,"<div>The Electricity Supply Act 1990 is an act to provide for the regulation of the electricity supply industry, the supply of electricity at reasonable prices, the licensing of any electrical installation, the control of any electrical installation, plant and equipment with respect to matters relating to the safety of persons and the efficient use of electricity and for purposes connected therewith.<br>&nbsp;<br>&nbsp;Relevant regulations enacted under this Act are:</div><ul><li>Electricity (Amendment) Regulations 2013: These regulations introduce Minimum Energy Performance Standards (MEPS) for appliances such as air-conditioners and refrigerators, as well as for lighting. The regulations outline a 'star rating' from 1-5 as well as minimum levels that specific electrical appliances must achieve (for example, domestic fans must achieve a MEPS of two stars).</li><li>Efficient Management of Electrical Energy Regulation 2008: Under the regulation, all installations that consume 3 million kWh or more of electricity over six months must have an electrical energy manager. The energy manager is responsible for analysing the total consumption of electrical energy, advising on the development and implementation of measures to ensure efficient management of electrical energy and monitoring the effectiveness of the measures taken.</li></ul>"
